Id,Date,Topic,Text,Rank
1602115,2018-11-28,"הצעת חוק התרת נישואין אזרחיים (תיקוני חקיקה), התשע""ה–2015","אבל ביום שישי. יום שישי – למסגד, שבת – לבית הכנסת. מה דעתכם? אז יש לי חדשות בשבילכם. באותה מידה שאי-אפשר להעביר חוק לחייב את אזרחיות ואזרחי ישראל ללכת להתפלל בבית התפילה של הדת שלהם, אי-אפשר לחייב אותם ללכת להתחתן או להתגרש בבית הדין של הדת שלהם. פשוט אי-אפשר. במדינה דמוקרטית אי-אפשר. ובכל זאת מדינת ישראל עושה את זה. במדינת ישראל מי שרוצה להתחתן יכולה או יכול לעשות את זה רק בבית הדין הדתי של המדינה שלהם. עכשיו מה? בית הדין הזה, בשני המקרים – המוסלמי והיהודי, היהודי והמוסלמי – לא מכיר בשוויון בין גברים לנשים. מבחינתם הנישואים זה חוזה בעלות. הבעל – לא סתם קוראים לו בעל; הוא הבעלים של האישה; יש לו זכויות שלה אין. אצל היהודיות והיהודים הוא יכול אחר כך לסרב לתת לה גט, והדיינים הם רק גברים, והם יכולים לאפשר לו לסרב לתת לה גט. עכשיו מה? משום שבמדינה דמוקרטית לא יכול להיות מצב שאין חופש דת, מה שעושות ועושים אלה שלא רוצות ולא רוצים להתחתן בנישואים דתיים – מרחיקים למחוזות מחוץ למדינת ישראל ומתחתנים בנישואים אזרחיים; נרשמות ונרשמים בנישואים אזרחיים בקפריסין, באמסטרדם, בניו יורק. ציבור שמצביעה ברגליים, בידיים ובמיטב כספם נוסעות ונוסעים רחוק, לוקחות את כל המשפחה, מזמינות ומזמינים מלון, ומתחתנות ומתחתנים בנישואים אזרחיים. חוזרות וחוזרים לישראל, גברתי היושבת-ראש, נרשמים בישראל, ואז, שערו בנפשכם, חברות וחברים: גם אם התחתנתם בנישואים אזרחיים בחו""ל, להתגרש אתן יכולות בישראל רק דרך בית הדין הרבני או בית הדין השרעי. רק דרך בית הדין הדתי. אין לכם שום אפשרות לעשות גירושים אזרחיים. עשיתם את כל המאמץ, הלכתם והתחתנתם בנישואים אזרחיים בחו""ל, והחוק הישראלי כופה עליכם ומכריח אתכם ללכת ולהתגרש בבית הדין הדתי. את המצב האבסורדי והמעוות הזה באה הצעת החוק שלי לתקן – המצב האבסורדי שבו מדינת ישראל מחויבת באמנות, ולכן מכירה בנישואים אזרחיים במקומות אחרים ורושמת אותם, אבל לא נותנת למי שהתחתנו בנישואים אזרחיים את השירות הבסיסי של גירושים אזרחיים ולא דתיים. עכשיו, גברתי, תני לי לספר לך כמה עוד יותר גדול האבסורד. אישה שהתחתנה בנישואים אזרחיים לא מקבלת זכויות בבית הדין הרבני. את יודעת למה? כי אין לה כתובה, אז היא לא תקבל מזונות, למשל. אין לה בבית הדין הרבני זכויות, אבל אם הרבנים יחליטו שיש חשש קידושין, הם יכולים לאפשר לגבר לסרב לתת לה גט, זאת אומרת זכויות אין לה, אבל את העונשים היא תקבל עד הסוף. מה הכי מופרך ודפוק בסיפור הזה? שמבחינה הלכתית נישואים אזרחיים הם בכלל לא נישואים. הם הרי לא נישואים כדת משה וישראל, ולכן הם בכלל לא נישואים. זאת אומרת, מה שאנחנו מדברות ומדברים עליו כאן זה שהכפייה הדתית הזאת נעשית לא מסיבות הלכתיות; היא נעשית מסיבות של כוח פוליטי נטו. זה מסיבות של להחזיק בבית הדין הרבני את כל אזרחיות ואזרחי ישראל שבויות ושבויים – זה נכון ליהודיות וליהודים, כמובן; בבית הדין השרעי זה נכון למוסלמיות ולמוסלמים. אותו משחק פוליטי כוחני של תקציבים, של כוח פוליטי כאן בכנסת. אפס קשר לדת, להלכה, לאמונה. אפס. רק ציניות פוליטית וכוחנית. מה שהצעת החוק שלי מבקשת, גברתי היושבת-ראש, זה את הדבר הבסיסי: מי שבחרה לא להינשא דרך בית הדין הדתי תוכל גם להתגרש לא דרך בית הדין הדתי. הצעת החוק שלי מבקשת לתת סמכות לבית המשפט לענייני משפחה, שכבר היום דן בכל ההיבטים האזרחיים של הפרידה, לרשום גם את הפרידה כגירושין בספר האוכלוסין של מדינת ישראל. זה לא עולה עוד כסף. לא רק שזה לא מפריע לאף אחד ואף אחת – זה מסייע. זה אפילו יפחית את העול מבתי הדין הרבניים. למעשה, זה גם יפחית את העול – איך להגיד? המקצועי מהדיינים, שבאים אליהם האנשים האלה שנישאו בנישואים אזרחיים, שאין להם תוקף דתי, ועכשיו הם צריכים להחליט מה בכלל לעשות איתם. חברות וחברים, ההצעה הזאת היא פשוטה מאוד: לתת לאזרחיות ואזרחי ישראל שלא רוצים נישואים דתיים את השירות הבסיסי של גירושים אזרחיים. אני רוצה להודות לזהבה גלאון, היוזמת הראשונה של הצעת החוק הזאת – ודאי אתן תגדנה את זה אחריי, אותו דבר – ואני קוראת לכן ולכם לעשות את הדבר הבסיסי וההגיוני הזה. תודה רבה.",10
1602144,2018-11-28,"הצעת חוק שיפוט בענייני התרת נישואין (מקרים מיוחדים וסמכות בין-לאומית) (תיקון – התרת נישואין אזרחיים), התשע""ח–2017","זה מה שהיא אמרה. זה מה שהיא אמרה. יכול להיות שאם היא הייתה עומדת פה ואומרת: תקשיבו, אני בעד, אבל זה יפרק לי את הממשלה – ואחרי הכול, הממשלה היא מעל הכול, בטח ממשלתו של בנימין נתניהו. שמעתי הבוקר את שרת המשפטים ברדיו מודיעה שבנימין נתניהו הוא גם ראש הממשלה הבא. מילא אם היא הייתה אומרת את הדבר הזה, הייתה לי אמפתיה לזה שהיא שומרת על הכיסא שלה. אבל היא לא טרחה להסביר אפילו את זה. היא רק אמרה: זה שינוי מדיניות מהותי, ואין לנו הסכמה בין סיעות הקואליציה. וכידוע, הקואליציה היא חזות הכול – לא האופוזיציה, לא הציבור, ובטח לא הנשים האלה, שרצו להימנע מבית הדין הרבני, ולכן נסעו להתחתן בחו""ל, אבל תמצאנה את עצמן בגירושים בבית הדין הרבני נטולות זכויות, ונתונות למרותם של דיינים גברים, שפוסקים לפי ההלכה, ולא לפי החוק הישראלי, בהרעת תנאים מטורפת. אז שרת המשפטים לא טורחת להתייחס לאלימות הזאת שמופנית על ידי החוק לנשים בישראל, כמו שהיא לא מתייחסת לאלימות הפיזית שמופעלת על נשים על ידי הבעלים שלהן, האבות שלהן, הגברים במשפחה שלהן, כמו שכל הממשלה הזאת מפקירה נשים; כמו שאנחנו רואות את בית הדין הרבני פוסק שוב ושוב לנשים עונשים על התנהגות שלא מוצאת חן בעיניו, ונותן משמורת על ילדות לאבות שחשודים בפגיעה מינית בהן. אנחנו מבקשות לצמצם את זה, ולו חלקית, וגם את זה אתם לא מאפשרות ומאפשרים לנו. שרת המשפטים – –",10
1631240,2020-06-17,שאילתות דחופות,"תודה, אדוני. א. אני מצטרפת כמובן לקריאה למצוא פתרון ראוי לסוגיה הקשה הזאת ביפו היום. חבל שהדברים הגיעו לנקודת רתיחה כזאת. אני מאמינה שצריך ואפשר היה למצוא לה פתרון קודם. אבל אני ברשותכם רגע רוצה לדבר על החיות והחיים, ולשאול אותך, אדוני: אני קיבלתי פניות מאזרחיות ואזרחים רבים שמרגישים – ואיך לומר, העובדות תומכות את התחושה שלהם – שמשרד הפנים מנצל את משבר הקורונה כדי לפגוע בזוגות שלא התחתנו כדת משה וישראל, גם אם הם רשומות ורשומים במדינת ישראל וגם אם יש להם ילדות וילדים. אני אסביר: אבא שגרוש מאישה ספרדייה, אבא יהודי, ישראלי, גרוש מאישה ספרדייה, ויש להם ילדים משותפים. הילדים חיים על הקו, הם נמצאים לפעמים עם אימא, לפעמים עם אבא. משרד הפנים לא מאפשר לילדות ולילדים לבוא לבקר את אבא שלהם מאז שהתחיל סיפור הקורונה. בחורה ישראלית, ישראלית יהודייה, נשואה בנישואים אזרחיים בחוץ-לארץ לגבר נורבגי – – –",8
1631250,2020-06-17,שאילתות דחופות,– – אני לא מצליחה להבין איך משרד הפנים מצדיק את הפגיעה הקשה הזאת באזרחיות ובאזרחים ישראלים שכל חטאם שלא התחתנו דרך הרבנות.,9
1651189,2020-10-14,"הצעת חוק הנישואין ופירוקם, התש""ף–2020","חברותיי וחבריי חברי הכנסת, זה נורא פשוט: מדינה שאין בה נישואים אזרחיים היא דמוקרטיה פגומה, פגומה בעומק. במדינת ישראל אין שוויון בנישואים לא רק לבני ובנות אותו מין, לא רק לאלה שהרבנות לא מוכנה להכיר בהם, לא רק לאלה שרוצות ורוצים להתחתן אולי עם בני ובנות דת אחרת, אלא גם בתוך הנישואים ההטרוסקסואליים שמותרים במדינת ישראל אין שוויון – לא אצל היהודיות והיהודים ולא אצל המוסלמיות והמוסלמים. הטקס היהודי, חברות וחברים, אני לא יודעת איך לספר לכם את זה, הוא טקס חד-צדדי: הגבר מקדש את האישה ומודיע לציבור שמרגע זה היא מותרת רק לו ואסורה עליהם. אחר כך, לפי אותו היגיון, אם היא רוצה להתגרש והוא לא רוצה לתת לה גט – איך להגיד? tough, בעיה שלך, חפשי אותו. אצל המוסלמיות יש בעיות אחרות, ברוך השם. אלחמדולילה, לא חסר. הקלות הבלתי-נסבלת שאפשר לגרש שם אישה בלי הזכויות שלה לא נובעת משוויון גדול בין גברים לנשים בתפיסה הדתית. זאת הדת, והדת היא פטריארכלית. ויש בישראל חופש דת חלקי, משום שמי שלא מאמינה או לא מאמין בדת לא יכולה לממש למשל את זכותה להתחתן, אבל הדת איננה יכולה להיות חוק מדינה, חברות וחברים. בדיוק כמו שאין חוק שמחייב לעשות ברית מילה, לא יכול להיות חוק שמחייב להתחתן בנישואים דתיים, לא בדת היהודית ולא בשום דת אחרת. ומדינת ישראל היום מחייבת את כל האזרחיות והאזרחים שלה להינשא בנישואים דתיים, או שיחפשו.",10
1651190,2020-10-14,"הצעת חוק הנישואין ופירוקם, התש""ף–2020","אין במדינת ישראל מסלול לנישואים שאינם דתיים. נקודה. זה מצב שהוא בלתי נסבל במדינה דמוקרטית והוא חייב להשתנות, ולהשתנות עכשיו. חברת הכנסת יוליה מלינובסקי הציגה פה לפניי הצעת חוק שמאפשרת מסלול לנישואים אזרחיים, ואני אומרת לכם, המסלול היחיד של רישום נישואים במדינת ישראל יכול וחייב להיות רק של נישואים אזרחיים. עם הרישום הזה, שנעשה על ידי המדינה והמדינה בלבד, אפשר ללכת אחר כך לאיזה רב שתרצו – לרב חרדי, לרב של צהר, לרבה רפורמית, לאברי גלעד – מה שנוח לכם, חברות וחברים, אבל הרישום יכול להיעשות אך ורק על ידי המדינה. גבירותי ורבותיי, חברות וחברי הכנסת, זה עניין בסיסי של חירות, של שוויון, של זכויות אדם. הכנסת הזאת חייבת לחוקק נישואים אזרחיים. כל יום שהיא לא עושה את זה היא משאירה את ישראל דמוקרטיה פגומה, פגומה במהותה.",10
1651296,2020-10-14,"הצעת חוק הנישואין ופירוקם, התש""ף–2020","אדוני השר פרץ, האם אדוני מודע לזה שהנישואים הדתיים הנוהגים במדינת ישראל, שהם היחידים האפשריים במדינת ישראל, הם שריד לימים שבהם לנשים לא היה מעמד בפני החוק? הנישואים הדתיים נוצרו בימים שבהן נשים היו רכוש של הגברים, כמו הגמלים, כמו הילדות והילדים, כמו האדמות. גם הנשים היו רכוש של הגברים. חלק – סימנו אותן בתור נשים רשמיות; חלק היו פילגשים, מעמד מס' 2. הנישואים הדתיים הם שריד לימים ההם, ומדינת ישראל מסרבת לעבור לעידן שבו נישואים הם ברית בין שני אנשים שווים, שווים, שלשניהם יש מעמד בפני החוק, לשניהם יש זכות בחירה, לשניהם יש זכות להשתכר, להיות עצמאית או עצמאי כלכלית, לשניהם יש זכויות לילדות ולילדים שלהם באותה מידה. פשוט מסרבת; מכריחה את האזרחיות והאזרחים שלה להינשא לפי טקסים, שמי שמאמין בהם – אדרבה ואדרבה. חופש דת. תנו למי שרוצָה ורוצֶה להינשא לפי הטקסים האלה את הזכות לעשות את זה. אבל למי שלא מוכנה להמשיך להיות קניין, מי שלא מוכנה להמשיך להיות חתומה על מסמך – היא אפילו בעצם לא חתומה עליו. אבא שלה חתום עליו, יחד עם זה שקונה אותה מאבא שלה – תנו לנו את האפשרות להינשא בנישואים אזרחיים. טוב, אני באופן אישי קצת פחות, אבל בסדר. הפגיעה בזכויות אדם, בהיעדר נישואים אזרחיים במדינת ישראל, באה לידי ביטוי אפילו בימים האלה של הקורונה, ככה שאחרי שהכרחתם את מי שלא רוצָה או לא יכולה להתחתן בישראל לנסוע להתחתן בקפריסין, באמסטרדם, בכל מיני מחוזות, ובאדיבות בית המשפט העליון להירשם כאן כנשואות – הרי אפילו זה בלתי אפשרי כרגע. אז אתם תוקעים אזרחיות ואזרחים ישראלים שאו שהרבנות מסרבת לחתן אותם או שהם לא מוכנות ומוכנים לעמוד במעמד הזה, פשוט תוקעים אותם בלי הזכות הכי בסיסית להתחתן. מדינה בלי נישואים אזרחיים היא דמוקרטיה פגומה, פגומה, פגומה. את הפגם הזה חייבות וחייבים פשוט לתקן. רק תצביעו בעד, נורא פשוט. נעשה כאן נישואים אזרחיים כמו במקום מתוקן.",10
1663122,2020-12-09,"הצעת חוק אימוץ ילדים (תיקון – אימוץ על ידי הורה יחיד), התש""ף–2020","תודה רבה, אדוני היושב-ראש. חברותיי וחבריי חברי הכנסת, אני חושבת שזאת הפעם הרביעית שאני מציגה כאן את הצעת החוק הזאת, הצעת חוק שמבקשת לעשות לא רק שוויון בין הורות והורים פוטנציאליים אלא לעשות צדק עם ילדות וילדים שזקוקים לבית ואין להם בית ויש בחוץ אנשים שמאוד מאוד ישמחו לאמץ אותם, אבל החוק במדינת ישראל לא מאפשר להם בכלל להגיש מועמדות או להיכנס לתור של אימוץ ילדות וילדים. והסיבה שהם לא יכולים לקבל את הזכות הזאת לאמץ היא פשוט משום שהם לא עונים להגדרה של ""איש ואשתו"". באמת, יש לי רק כבוד והערכה למי שחיים כאיש ואשתו באושר ועושר והכול ממש פיקס אצלם, אבל יש רבות ורבים במדינת ישראל שא. לא יכולים להיקרא איש ואשתו פשוט משום שאין להם איך להתחתן כאן, כי הם לא עונים על ההגדרות המאוד-מאוד צרות של בתי הדין הדתיים השונים, שהם היחידים שרשאים לרשום נישואים במדינת ישראל, ויש גם כאלה שבחרו לא להתחתן, ויש גם כאלה שלא יכולות ולא יכולים להתחתן, כי מדינת ישראל לא מכירה בכלל בסוג הנישואים שלהם, ויש גם כאלה שהם בודדות ובודדים, שלא חיים בזוגיות. ומה אני אגיד לכם, חברות וחברים? השאלה של התאמה להורות והיכולת לתת בית חם לילדה או לילד לא קשורה לא בנישואים, לא בזהות מינית, לא בעדה, לא בדת ואפילו לא בזוגיות. יש הורות והורים שיכולים לתת בית מדהים לילדות וילדים גם כשהם חיות וחיים לבד – שהכמיהה שלהם לתת את הבית הזה לילדה או ילד שבאמת, החיים לא סיפקו להם את הבית הטבעי במסלול הרגיל, שהרבה פעמים עברו דברים מאוד קשים וזקוקות וזקוקים בדיוק לאנשים שנורא רוצות ורוצים אותם – היכולת הזאת ממש לא תלויה לא בזוגיות, לא בהטרוסקסואליות, לא בנישואים ברבנות ולא בשום סוג של תיוג אחר שאנחנו עושות ועושים, לצערי, עדיין. ולכן, הצעת החוק שלי באה למחוק את המילים ""איש ואשתו"" ולהגיד: אימוץ יכול להיעשות על ידי כל אדם, בין שבתור יחיד ובין שלא בתור יחידה או יחיד, אך ורק לפי הקריטריונים המקצועיים, שיבדקו אם הוא או היא כשירים להיות הורות והורים. הדבר המדהים הוא שזאת גם ההמלצה של ועדה מקצועית שעסקה בנושא. והדבר שאולי לא מפתיע, אבל מדהים לא פחות, זה שמדינת ישראל – ממשלות ישראל התחייבו בפני בית המשפט העליון כבר לפני למעלה משלוש שנים לתקן את האפליה ואת העיוות הזה, אפליה כלפי אנשים, יחידות ויחידים; אפליה כלפי זוגות לא הטרוסקסואליים; כלפי הקהילה הגאה; אפליה כלפי כל מי שלא מציית להגדרה המשפטית המאוד-מאוד צרה הזאת ומיושנת של ""איש ואשתו"". מדינת ישראל התחייבה לבית המשפט לתקן את האפליה הזאת, ועד היום היא כשלה בלעשות את זה. אני רוצה לברך את משרד המשפטים ואת שר המשפטים, שהיום הציגו, הוציאו טיוטת חוק, תיקון לחוק האימוץ שסוף-סוף יביא סוף לאפליה הזאת. את הצעת החוק הפרטית אנחנו העלינו כאן מאז הכנסת התשע-עשרה, חברת הכנסת לשעבר מיכל רוזין ואני. היו פה דרמות במליאה, ושוב ושוב הבטיחו לנו: תשובה והצבעה במועד אחר, מייד מייד אנחנו מתקנות ומתקנים את העוול הזה, והוא עדיין לא תוקן. ואני אומרת לכן ולכם, חברותיי וחבריי, היום זה היום. היום, כשמשרד המשפטים סוף-סוף פרסם גם הצעת חוק ממשלתית בנושא – אני אהיה שמחה להצטרף אליה, אחרי שנעביר כאן את הצעת החוק הפרטית בקריאה טרומית, ונתקדם, אם תרצה השם, וממשלה אם תהיה או מה, ביחד. אבל כך או כך, את הצעת החוק הפרטית לתיקון העוול והאפליה באימוץ והפגיעה בילדות וילדים שמחכים להורים אנחנו חייבות וחייבים להתחיל היום. אני מאוד מאוד מאוד קוראת לכם לתמוך בהצעת החוק. תודה רבה.",8
1663261,2020-12-09,"הצעת חוק הכשרות המשפטית והאפוטרופסות (תיקון – ביטול חזקת הגיל הרך), התשפ""א–2020","תודה רבה, אדוני. חבר הכנסת מתן כהנא, שמשתייך למפלגה דתית ימנית, מביא הצעת חוק לבטל את חזקת הגיל הרך שמקורה, אם לא אכפת לאדוני, בדין הדתי – הדין הדתי במדינה יהודית, שאמורה להיות גם דמוקרטית, אבל יש בה אך ורק נישואים דתיים.",6
