Id,Date,Topic,Text,Rank
1591313,2018-04-30,"הצעת חוק יסודות המשפט (תיקון), התשע""ח–2018","ועוד דקה. הינה, סיפור שהיה באמת באחת מיחידות הסיוע, שעושות עבודה מדהימה בעבודה על החוק הזה ומצליחות להביא לכך שלמעלה מ-50% מהמקרים שמגיעים לפתחן לא יגיעו לבית הדין או לבית המשפט להתכתשות. זוג שבאמת הגיע להסכם, ולא זו אף זו, הם הגיעו להסכם ולכל הסדרי המשמורת, המזונות וחלוקת הרכוש, והגיעו להחלטה שעל מנת להקל על הילדות והילדים את המשבר הקשה הזה של הגירושים הם יישארו לגור באותו בניין – בשתי דירות נפרדות כמובן; הוא בדירה משלו, היא בדירה משלה, אבל באותו בניין. שמעו דייני בית הדין הרבני שזאת החלטת בני הזוג ואמרו להם: לא, לא, לא, לא, לא, חברים, במקרה כזה לא תקבלו גט. לא ניתן לכם גט. למה? משום שיש חשש שהגרוש יחוש חשק לפתע פתאום לבעול את גרושתו, ואנחנו לא נוכל לאפשר סיכון שכזה, ולכן לא ניתן לכם גט אחרי שהגעתם להסכמים המדהימים האלה ביניכם. זה, חברותיי וחבריי, מה שקורה במקום שבו שופטים לפי המשפט העברי. אלה דברים שקורים שם, לצערי, על בסיס יומי לגמרי. אלה דברים שקורים במדינת ישראל בערכאה שיש לה סמכות מקבילה לבית משפט במדינה דמוקרטית. ככה מתנהל יותר מדי פעמים דין לפי המשפט העברי. את זה אנחנו באנו ושמנו בחוק יסודות המשפט. זה מה שעומד כאן להצבעה, חברות וחברים, אל תטעו. זה בדיוק. הזוג הזה הם אנשים מאמינים, היא מאמינה והוא מאמין, ולכן הם נבהלו נורא לא רק מהאיום שהם לא יקבלו גט אלא גם מהעובדה שאוי ואבוי, המשפט של הדת שבה הם כל כך מאמינים אומר דבר כזה, ולכן אכן התפצלו מייד; אגב, לא רק לשני בניינים אחרים, אלא לשכונות אחרות, משום שבשולחן ערוך כתוב שכונה אחרת. אבל מה אם היה מדובר בזוג שהם לא מאמינים? איך אפשר, חברותיי וחבריי, לכפות על אדם לא מאמין דין שהוא, בשונה מחוק של מדינה דמוקרטית, לא התקבל במקום הזה, לא התקבל על ידי נציגות שנבחרה, לא זכה לדיון של בעד ונגד, לא עומד בקריטריונים של דמוקרטיה, לא יכול לעמוד לשום שיפוט, משום שהוא איזה צו אלוהי שיש מי שמאמינות ומאמינים שירד מהר סיני; בסדר גמור, אבל באיזה עולם אפשר לכפות את הדין הזה על אזרח או אזרחית במדינה דמוקרטית? למותר לציין, חברות וחברים, שזה דין שאיננו מכיר בשוויון. הוא גם לא מכיר לא רק בשוויון בין לא יהודיות ויהודים ליהודים, הוא גם לא מכיר בשוויון בין יהודיות ויהודים. קודם כול הוא לא מכיר בשוויון יהודיות מול יהודים, כמובן, והוא ודאי לא מכיר בסוגי יהודים שלא בא לו להכיר בהם. ולכן אפילו בתור מדינה שאמורה להיות מדינת הלאום של העם היהודי כבר לא ברור בכלל שהיא עם החוק הזה יכולה להיות מדינת כל יהודיה ויהודיותיה. העניין הוא – ובזה אני אסיים, חברותיי וחבריי, ועל זה צריך באמת להסתכל בעיניים פקוחות נכוחה ולהבין – שהדברים האלה שאני אומרת, לצערי, הם המוטיבציה שמביאה לחקיקת החוק הזה: בדיוק הרצון לא לאפשר זכויות של שוויון לכל היהודיות והיהודים, לנשים, ללהט""ביות ולהט""בים, וודאי ללא יהודיות ויהודים. המוטיבציה שעומדת בבסיס הדברים היא בדיוק לשים בחוק יסודות המשפט את הדבר שיצטרך לאפשר לבית המשפט העליון, כל זמן שגם עוד לא העברנו את פסקת ההתגברות, להגיד: אני נורא רוצה לתת זכויות אבל ידיי כבולות, מה לעשות. ולכן, חברות וחברים, כל כך חשוב להצביע נגד הצעת החוק הזאת, ככל שהניסוח שלה הוא כאילו פשרני וכאילו לא כזה סיפור וכאילו נועד רק לתת כבוד למסורת שלנו. הכבוד שלנו כאן ועכשיו מחייב שנצביע נגדו. תודה רבה.",10
1595183,2018-10-24,"הצעת חוק בתי דין רבניים (קיום פסקי דין של גירושין) (תיקון – הגבלת שימוש בכרטיסי אשראי לסרבני גט), התשע""ח–2018","אנחנו מדברות באופן כללי על המשך האלימות של גברים אלימים כלפי נשים באמצעות סירוב גט, כשהאישה כבר אוזרת כוחות ומחליטה ללכת. עכשיו, חבריי וחברותיי, בואו נדבר על האמצעים שיש בידי בית הדין הרבני להעניש את סרבן הגט עד שיאמר: רוצה אני. אז בואו נדבר על זה שלבית הדין יש אמצעים הלכתיים לא לעשות את הדבר הזה – לאפשר לגבר, לבעל, לשלול את החופש והחירות וזכויות הכי בסיסיות של האישה, ולא לפגוע בזכויות שלו; לא לפגוע בחירות שלו ולא לפגוע ביכולת שלו להשתמש בצ'קים או בכרטיס אשראי ופשוט, נניח, לבטל את הנישואים או להפקיע את הקידושין. וללמדכם עד כמה הדבר הזה אפשרי, ממש לא מזמן אישה שהייתה עגונה במשך 20 שנה, כשמתוכן 17 שנה בעלה יושב בכלא ולא נותן לה גט, הלכה בצר לה, כשהתייאשה מבתי הדין הרבניים שלנו, לבית דין פרטי – אורתודוקסי לא פחות מבתי הדין החרדים אורתודוקסיים שלנו – והוא באמת ביטל את הנישואים. ואז הלכה האישה הזאת, ש-20 שנה הייתה בכלא העגינות שלה, וביקשה מבית הדין הרבני לשחרר את מי שהוא כבר לא סרבן גט, כי בעצם הוא כבר לא נשוי לה. לשחרר אותו מהכלא. מבחינת בית הדין, הוא המשיך להחזיק בכלא את האיש הזה, שהוא כבר בכלל מבחינה הלכתית לא נשוי לאישה הזאת, שהוא עיגן אותה במשך 20 שנה. הפטנט הזה שלכם, להמשיך להחזיק את עליונות הבעל על האישה, את עליונות בתי הדין – שבהם יש רק דיינים גברים ואין נשים בכלל – על שאר מותר היהודיות והיהודים בישראל – –",8
1595184,2018-10-24,"הצעת חוק בתי דין רבניים (קיום פסקי דין של גירושין) (תיקון – הגבלת שימוש בכרטיסי אשראי לסרבני גט), התשע""ח–2018","– – ואת מותר האורתודוקסיה, בתור בעלת הבית המונופוליסטית היחידה על מוסד הנישואים – גורם להפרה של זכויות אדם לנשים ולגברים.",9
1595220,2018-10-24,הודעה אישית של חברת הכנסת מרב מיכאלי,"תודה, גברתי. חבר הכנסת סמוטריץ, זה שאתה עומד פה ומתנשא, לזה אנחנו רגילות כבר, אבל לא משנה כמה תעמוד פה ותתנשא ותגיד שעובדות זה לחלשים, לא תשנה את העובדות. והעובדות הן שבתי הדין הרבניים הגיעו לדיון בוועדת החוקה לפני שבוע בנושא הזה וסירבו לתת נתונים. באו ואמרו: למה ביקשו מאיתנו רק לפני שבוע את הנתונים? לא יכולנו להכין בשבוע את הנתונים. אנחנו מבקשות את הנתונים האלה מאז שאני באתי לכנסת, אבל משום מה – מעניין למה הם לא נותנים נתונים, לא על מספר התיקים של סירובי גט, לא על החלוקה שלהם, ובטח ובטח לא על מה הם עשו ועושים בעניין הזה. בניגוד למה שאתה מנסה להציג באופן קבוע, אין בינינו שום ויכוח על זה שמדינת ישראל היא מדינת הלאום של העם היהודי. אבל מדינת ישראל היא מדינת הלאום של כל העם היהודי, היא מדינה דמוקרטית ולא מדינת הלכה. ולכן, חוקי הלכה לא יכולים להיות חוקי מדינה. מספיק גרוע שההלכה לא מתעדכנת; אי-אפשר לגרום להלכה לקחת את מדינת ישראל להיות כל כך רחוק מאחור.",8
1596119,2018-10-31,"הצעת חוק מרשם האוכלוסין (תיקון – רישום הורה נוסף), התשע""ז–2017","תודה רבה, אדוני. מזל טוב, חבריי וחברותיי. מזל טוב. מורן ילדה בן בכור מהמם ויפה תואר, יהונתן. מורן המאושרת ניגשת לפקידת הרישום של משרד הפנים לרשום את הילד. היא לא נשואה, מורן. היא ניגשת לפקידה עם דוד ואומרת לפקידת הרישום שהוא האבא. דוד מאשר שהוא האבא. הוא נרשם כאבא והם הולכים הביתה שמחות ושמחים וטובי לב לעבר הלילות ללא שינה שמצפים להם בבית. אממה? דוד הוא לא האבא הביולוגי של יהונתן. דוד גם לא נשוי למורן. אומנם הוא חי איתה באושר ועושר שנים ארוכות, אבל בגלל בעיה באיכות הזרע יהונתן נולד מתרומת זרע. כלומר, דוד לא נשוי למורן, הוא לא האבא הביולוגי של יהונתן, ובכל זאת הוא נרשם כאבא שלו בלי בעיה, ויהונתן הולך הביתה עם שני הורים רשומים. באותה מחלקה עצמה: מזל טוב, רווית ילדה בן בכור יפה תואר, מיכאל. גם רווית לא נשואה, גם מיכאל נולד מתרומת זרע, וההורה השני שלו הוא לא ההורה הביולוגי שלו אבל הוא מי שרווית חיה איתו באושר ועושר עד עצם היום הזה, שנים ארוכות. אבל ההורה הזה לא יכול להירשם כאבא של מיכאל כי זה לא הוא; זה היא. קוראות לה אורלי. ולמרות שהיא בדיוק באותו מעמד ובדיוק באותו מצב של דוד, הוא יכול להירשם כאבא, והיא לא יכולה להירשם כעוד אימא. אגב, הסיפור של רווית ואורלי הוא אמיתי. הילד, לא קוראים לו מיכאל, הוא מחוץ לסיפור הזה, אבל הן מנהלת כבר יותר משנתיים מאבק על הרישום של אורלי כהורה נוספת לילד שלהן, לבן הבכור. זאת האפליה הצבועה והבלתי-נסבלת של רישום הורים והורות מתרומת זרע בישראל. עכשיו, תנו לי להפנות את תשומת ליבכם לסעיף שאותו אני מבקשת לתקן. זה סעיף 21 בחוק מרשם האוכלוסין, ובו כתוב: ""שם האב כשהאישה פנויה"" – פנויה, כלומר לא נשואה. ביום אחר נדבר על המשמעות של אישה פנויה, המינוח הזה, אבל כתוב בסעיף הזה: ""שם אביו של ילד שנולד לאישה פנויה יירשם על פי הודעת האב והאם כאחד, או על פי פסק דין של בית משפט או בית דין מוסמך"". זאת אומרת, האישה יכולה לבוא, בדיוק כמו מורן ודוד, ולהגיד: הוא האבא, והוא יירשם כאבא. החוק הזה הוא משנת 1965, חברות וחברים. בשנת 1965 לא הייתה תרומת זרע, בשנת 1965 לא הייתה מודעות לזכויות הקהילה, ובכלל לקיומם של זוגות להט""ביות ולהט""בים וכו', אבל מה שהיה זה רצון עז של המחוקק – אז הוא היה באמת באופן הרבה יותר הומוגני מחוקק – רצון עז של המחוקק שלילדה או לילד יהיו שני הורים. הבית הזה, כשהוא העביר את החוק הזה בשנת 1965, רצה שגם אם האישה לא נשואה, יכול לבוא בן הזוג שלה, או אדם אחר – לא כתוב פה בן זוג; כתוב: ""יירשם לפי הודעת האם והאב"". לא כתוב אב ביולוגי. כתוב: ""יירשם לפי הודעת האם והאב"", ההורה השני של הילדה או הילד. מה שעושה ממשלת ישראל, ולכן, למרבה הצער, כנסת ישראל, כבר הרבה שנים – היא לא מסכימה לתת לילדות ולילדים את הזכות הבסיסית כל כך, שפשוט יהיה להם עוד הורה או הורה. הכנסת והממשלה האלה מונעות מילדות וילדים את היכולת לזה שיהיו להם שני הורים רשומים. זה פשוט דבר מדהים. בעצם, הפעולה שאתן עושות ועושים ממש סותרת את הרעיון המרכזי של הסעיף הזה בחוק. עכשיו מה? הנוהל היה שהיה צריך לעבור אימוץ. זוגות בני ובנות אותו מין, גם רווית ואורלי, היו צריכות להעביר את הבן הבכור שלהן – אורלי הייתה צריכה לעבור הליך אימוץ. בעקבות מאבק ארוך ופניות חוזרות שלי ליועץ המשפטי לממשלה הקודם יצאה הנחיה חד-משמעית שלו שלא צריך לעבור תהליך אימוץ, ומספיק צו הורות. אבל, חברות וחברים, א. גם צו הורות הוא מהלך מפלה, משום שזוגות סטרייטים, כשהאבא איננו האבא הביולוגי ואיננו נשוי לאם, לא צריכים צו הורות. וצו הורות הוא תהליך יקר, והוא תהליך פולשני, והוא בודק דברים שהורות והורים רגילים לא צריכים לבדוק, ואין כל סיבה שבני ובנות אותו מין כן יצטרכו לבדוק. אבל גם בצו ההורות הממשלה הזאת נאבקת. גם את צו ההורות הזאת הממשלה הזאת לא מיישמת, ולא מעניין אותה הדברים שאמרו – למשל השופט העליון סלים ג'ובראן, שהדגיש את האפליה הקשה כלפי בני ובנות אותו מין, ואמר בצורה מפורשת שהמדיניות הממשלתית היא שמעצבת את הזוג ההטרוסקסואלי כטבעי כביכול, ויוצרת חזקת אמיתות להורות והורים הטרוסקסואלים, תוך שהיא מעצבת את ההורות של בני ובנות זוג מאותו מין כמין הורות בספק; משהו חשוד, שדורש איזו מתנה מיוחדת של המדינה, איזה מין הכרה שתודה רבה באמת אם המדינה נותנת אותה. אומר השופט ג'ובראן בצורה מפורשת: זאת תפיסה שאין לקבלה. יש בה פגיעה עמוקה בכבוד ובשוויון ובזכות החוקתית של כל אדם לחיי משפחה. בבתי המשפט, כשנותנים צו הורות, כבר גם אומרים דברים יותר מפורשים, למשל: יש לצמצם ככל הניתן את הפער בין המציאות המעשית, שבה בת הזוג היא האם בפועל של הילד, היא מגדלת אותו, היא ההורה שלו – בין המציאות המעשית לבין ההכרה המשפטית בהורות. ברור שבדומה לכל ילדה או ילד שנולד במסגרת תא משפחתי זוגי, במעמד הלידה האם יכולה לציין את שם ההורה הנוסף של הילד, יהא מינו אשר יהא, ולהביא להכרה משפטית במעמדו או במעמדה של ההורה הזאת. חברות וחברים, הדברים הם כל כך פשוטים וברורים. באמת מה – תסלחו לי על הביטוי –כואב לכם? מה כואב לכם? בהצעת החוק שאני הגשתי כבר בכנסת הקודמת מוצע לתקן את הצעת החוק כך שההורה השני יוכל או תוכל להירשם. לא כתוב: בני ובנות זוג מאותו מין, חלילה, שלא תהיה, אדוני היושב-ראש, הכרה בחוק הישראלי במשהו שההלכה מתחלחלת ממנו כל כך, למרות שבינינו, נשים מסוללות זה משהו שאפילו המסגרת המורחבת של ההלכה מכילה. אבל גם את זה אתם לא מסוגלות ומסוגלים להעביר? ניסוח כל כך פשוט, לא מתריס, לא בעייתי – גם את זה אתם לא מסוגלים, את הדבר הבסיסי, לתת לילדות וילדים? לתת להם את שני ההורות וההורים שמגדלים אותם? אדוני, אני רוצה לספר לך שגם אחרי שניתנה הנחיית יועץ, הממשלה הזאת נאבקת בזוגות שמבקשים לרשום את הילדות והילדים שלהם. למשל, המדינה ביקשה תצהיר מאישה שהיא לא הורשעה בעבר בעבירות מין או אלימות. זאת אישה שיש לה חמישה ילדות וילדים קודמים שהיא מגדלת, אבל לפתע, בשביל להירשם כאימא של הילדה של בת הזוג שלה, היא נדרשת להביא הוכחות שהיא איננה מסוכנת. איפה הייתם בחמשת הילדות והילדים הקודמים שלה? בגלל שהם ביולוגיים אז היא לא יכולה להיות מסוכנת להם? למה כשמדובר בילדה של בת הזוג שלה היא כן תהיה מסוכנת? בתי משפט לענייני משפחה דורשים מנשים לספק הוכחות לקיום הקשר ביניהן ולקשר האותנטי שיש להן עם ילדות וילדים. אני רואה שהזמן שלי תם, אז אני רוצה לספר לך, אדוני, שהמדינה תוקעת את העקבים שלה נגד הזוגות ההומואים והלסביות כל כך עמוק, שעכשיו, כשרווית ואורלי מתעקשות בבית המשפט, אז המדינה הודיעה שמעכשיו גם אבות הטרוסקסואלים, גברים הטרוסקסואלים, יצטרכו להתחייב שהם האב הביולוגי, זאת אומרת, הם יצטרכו להצהיר אם זו תרומת זרע או לא אחרי שהילדה או הילד נולד. זה להעביר עכשיו את כל המערכת למין הודאה פומבית מבישה כזאת: אני כן האב ביולוגי, אני לא האב הביולוגי. ידרשו מהם להצהיר את הדבר הזה. זאת אומרת, גברים יצטרכו לעבור את המעמד המשפיל הזה, או להיות בעצם עבריינים ולשקר במעמד הזה. אדוני, מדובר בהתעמרות שערורייתית שחייבת להיפסק. אני אחזור ואגיד: מדובר בנוסח ממש לא בעייתי.",9
1596135,2018-10-31,"הצעת חוק מרשם האוכלוסין (תיקון – רישום הורה נוסף), התשע""ז–2017","אדוני סגן השר נהרי, לא אני יוצרת הורות חדשה; זאת הורות קיימת, חיה ובועטת מהרבה מאוד סוגים, ולא משנה כמה תמשיכו לטמון את הראש שלכם בתוך החול, גם למה שקורה בתוך הקהילות שלכם. זה לא ישנה את המציאות שההורות הזאת הולכת ומתפשטת, קיימת בכל מקום, בכל מגזר בחברה הישראלית, והיא הורות טובה ומיטיבה לא פחות מכל הורות אחרת. ואני אפנה אותך שוב למילותיו של שופט העליון. אתה ציטטת מבית המשפט העליון מה שנוח לך, אבל השופט סלים ג'ובראן אמר: צריך לצמצם את הפער בין המציאות המעשית, שבה בת הזוג היא האם בפועל של הילד, לבין ההכרה המשפטית בה, וצריך לאפשר שבמעמד הלידה היא תירשם בתור אם. ואמר השופט סלים ג'ובראן שהמדיניות הממשלתית היא שעושה את האפליה בין זוג כאילו טבעי והורות כאילו אמיתית לבין הורות נחשדת בכל מיני חשדות, שמחייבת כל מיני בדיקות מחפירות ומשפילות. אבל אני עוד פעם רוצה להגיד שני דברים מרכזיים: החוק המקורי, שמאפשר להורות להירשם לפי הודעת האם והאב, לא אומר ""ביולוגי"", ומטרתו היא לאפשר לילדות ולילדים שיהיו להם שני הורים. ואתם באים למנוע מילדות וילדים את הזכות הבסיסית לזה שיהיו להם שני הורים, וזה לא משנה מאיזה מין. אתם מתעללים לא רק בבני ובנות מאותו מין, לא רק בחברות וחברי הקהילה, אלא גם בילדות ובילדים שלהם, ואתם כל כך הולכות והולכים אחורה בממשלה הזאת, שעכשיו אתם הולכים להתעלל גם באבות סטרייטים שנאלצו להשתמש בתרומת זרע בשביל להיות אבות. זה מה שעכשיו אתם עושים. ולסיום, אדוני, עם כל הכבוד, בניגוד למה שאמרת, הצעת החוק שלי, שהוגשה בכנסת הקודמת, עברה ועדת שרים של הממשלה הקודמת, היא התקבלה בוועדת השרים של הממשלה הקודמת, אבל אז השר אורי אריאל הגיש עליה ערר. מה מעניין? שאיילת שקד, שהייתה חברת כנסת בכנסת הקודמת, הייתה בעד הצעת החוק הזאת, אבל היום, כשרת המשפטים שיושבת בראש ועדת שרים לענייני חקיקה – איך להגיד? פתאום היא משרתת אינטרסים חשוכים, ארכאיים ובאמת מתעללים, ופשוט לא מאשרת את ההצעה הזאת. זאת האמת ואין בלתה. תסתכל לילדות ולילדים של אימהות ואבות בעיניים ותגיד להם: אין לכם זכות שההורים שלכם יהיו רשומים בתור ההורים שלכם. זה מה שאתם אומרים. זה מה שאתם עושים. אין לכם דרך להתחמק מזה.",6
