Id,Date,Topic,Text,Rank
1465297,2016-02-24,"הצעת חוק משפחות חיילים שנספו במערכה (תגמולים ושיקום) (תיקון – הגדרת אלמן ושכול), התשע""ה–2015","– – שיבוא לתת הכרה וזכויות לקהילה שאתה משתייך אליה, שרבות ורבים אומרות – כמו שאמרת אתמול אתה בעצמך – 10% מכל ציבור משתייך לקהילה הזאת, קהילת הלהטב""קים והלהטב""קיות. אדוני היושב-ראש, מדובר באלמנות, אלמנים, גרושות, גרושים והורים שכולים. וכל חטאם, שהאלמן הוא לגבר או האלמנה לאישה, או שהילד ששכלו יש לו שתי אימהות או שני אבות. זה כל חטאם של האנשים שמדובר בהם בחוק הזה. והחוק הישראלי מפנה להם עורף. החוק הישראלי לא מכיר בהם, לא רואה אותם. החוק הישראלי מדיר אותם, והממשלה והקואליציה הזאת מתעקשות להשאיר את המצב הזה על כנו. אתה יודע, אדוני היושב-ראש, הרבה פעמים קורה שלא מבחינים – כן, החוק נוסח בתקופה אחרת, כשהאופציה הזאת של בני ובנות זוג מאותו מין לא הייתה כל כך פתוחה ואפשרית; אנשים נאלצו להתחבא, אפילו היה חוק שאסר יחסי זוגיות בין גברים, יחסי מין בין גברים. אבל המציאות השתנתה והחוק חייב לאפשר למציאות להשתנות. החוק לא יכול להישאר מאחור ולהכריח את המציאות להיות מה שהחוק קובע שהיא, זה פשוט לא עובד ככה. חבל מאוד שהממשלה והקואליציה הזאת חושבות שהן תוכלנה לעשות את זה. אני קוראת לכם, חברות וחברים: אלמנות צה""ל, יתומות ויתומי צה""ל, הורים שכולים – תנו להם את ההכרה שמגיעה להם בהיותם בני ובנות אדם. תודה רבה.",10
1465584,2016-02-24,"הצעת חוק אימוץ ילדים (תיקון – אימוץ על-ידי אזרח ישראלי), התשע""ה–2015","תודה רבה, אדוני. החלטתי, בשונה מחברותי וחברי שהבטיחו להם פה תשובה במועד אחר – החלטתי לקחת את זה, למרות שמדובר בנושא טעון לא פחות. ההצעה שמדובר בה, חברות וחברים, היא שינוי הנוסח – למי מותר ומי רשאי או רשאית בישראל לאמץ ילדות וילדים. היום כתוב בחוק, שאימוץ ייעשה רק על-ידי איש ואשתו, כלומר, רק על-ידי זוג נשוי, כזה שרשום במדינת ישראל כנשוי. וכזכור, במדינת ישראל יש רבות ורבים שעדיין לא יכולות ויכולים להתחתן, גם אילו רצו בכך – ולא כולם ולא כולן רוצות ורוצים בכך. ויש המוני ילדות וילדים שלא יימצא להם בית בגלל שהם לא מספיק טובים להימסר לזוג נשוי, אלא רק למי שהוא בְּרָרָה – לא נשוי, או חס וחלילה הורה יחיד או יחידה, או – עוד יותר חס וחלילה – הוֹרֶה והוֹרֶה או הורָה והורָה. אתה יודע, אדוני היושב-ראש, עמד פה ראש הממשלה אתמול, כשציינו לראשונה בכנסת את יום הזכויות של הקהילה הגאה; בא במיוחד למליאה ביום שלישי אחרי הצהריים, עלה לדוכן ואמר: אני רק רוצה להגיד משפט אחד – הוא אמר: כל אדם נברא בצלם; ואמר עוד דבר: עמנו – אמר ראש הממשלה בנימין נתניהו – עמנו הוא זה שהביא את זה לציוויליזציה לפני המון, המון, המון, המון שנים. והנה, עמדנו כאן היום עוד ועוד חברות וחברי כנסת והצענו הצעות חוק שיביאו שוויון לכל אדם שנברא בצלם, והקואליציה הצביעה נגד כולן. לא רציתי שאותו דבר יקרה בחוק האימוץ. על פניו יש ועדה שיושבת על המדוכה, למרות שצריך להגיד שיושב-ראש האופוזיציה, יושב-ראש המפלגה שלי יצחק הרצוג, כבר עשה כשר רווחה אי-אלו שינויים ביכולת לאמץ, והיום זה יותר פתוח, אבל החוק, החוק עדיין מכיר רק זוג נשוי כמי שבכלל מותר לו להגיש מועמדות לאמץ ילדה או ילד. ומה פשעם של כל הילדות והילדים שיכולים להיות מאומצים על-ידי הורים נפלאים, הורות נפלאות, אבל הן פשוט לא נשואות? איזה היגיון יש להגיד: אדם לא יוכל בכלל להגיש מועמדות, לתת לרשויות לבדוק אם הוא מתאים או מתאימה להיות הורָה, רק בגלל שהוא לא נשוי או נשואה. ההצעה שלנו אומרת, אדוני: כל אחד – בהתאמה, כמובן – בהתאם להחלטת הרשויות, יוכל לאמץ; כל אחד, כל אחת, לבד או במשותף. אנחנו החלטנו לחכות לממשלה, לקבל את המלצות הוועדה שעוסקת בענייני האימוץ ולקוות שזאת תהיה המסקנה, ושהממשלה תאפשר לקבל אותה ולהעביר אותה בחוק. בהמשך לציון היום המיוחד לזכויות הקהילה, ובאמת מתוך הכרה שכל אדם נולד בצלם ולכל אדם, לפחות בעיקרון, יש זכות להיות הורֶה או הורָה, אני מניחה את הצעת החוק הזאת כאן היום ואחכה, כמו שאמרנו גם קודם, בהחזקת אצבעות לתשובת הממשלה במועד אחר. תודה רבה.",7
1481990,2016-06-27,"הצעת חוק שירותי הדת היהודיים (תיקון מס' 21) (הסדרת השימוש במקווה טהרה), התשע""ו–2016","רות המואבייה לא הייתה עוברת גיור, רות המואבייה לא הייתה יכולה להתחתן, לא עם בועז, ולא – – –",5
1481992,2016-06-27,"הצעת חוק שירותי הדת היהודיים (תיקון מס' 21) (הסדרת השימוש במקווה טהרה), התשע""ו–2016","רציתי להגיד שרות המואבייה לא הייתה יכולה להתחתן, גם לא עם נעמי אהובתה האמיתית, והילד שהיה נולד להן, לשתיהן, לא היה יכול להירשם על שמה. רות המואבייה הייתה פה באמת עובדת זרה, במובנים הרעים ביותר. היא הייתה סובלת פה. באמת, אי-אפשר לתאר איך היא הייתה סובלת במדינה של האנשים שלמישהי מהם היא אמרה: עמך עמי, אלוהייך אלוהי. אבל אני רוצה להגיד שאני לא באתי לדבר. דווקא חברותי פה כיסו את הסוגיות האלה בהרחבה. אני רציתי לדבר על משהו אחר, ברשותך, מר גפני היקר. אני יודעת שמבחינתך ומבחינת חבריך, אתם מסרבים לראות בבית-המשפט העליון סמכות. אבל בכל זאת, בית-המשפט העליון מאפשר לכם – ואני אומרת ""לכם"" – מאפשר לכם את המכונה סטטוס-קוו. בית-המשפט העליון הוא הצינור הזה שמוציא את הקיטור, הצינור הזה שנותן לציבור במדינת ישראל את הזכויות – חבר הכנסת גפני, הוא מפנה אלי את הגב. זה – איך להגיד? שובר לב. אני לא מדברת כבר על – – –",8
1490890,2016-07-25,"הצעת חוק שירותי הדת היהודיים (תיקון מס' 21), התשע""ו–2016","וההלכה הזאת היא גם שלי, וגם של כולנו, בדיוק באותה מידה. ולכולנו יש זכות לפרש אותה – בדיוק כמו שאתם מפרשים אותה. ובדיוק כמו שאתה יכולת, על חוק הובלת נפטרים שלי, לעשות סצנה, ולהגיד: כתוב שם שיהיה חילול שבת, אפילו שלא היה כתוב שם חילול שבת, אני יכולה להגיד לך – בחוק הזה כתוב: תיסגר הדלת למקווה, כשאתה יכול להגיד שלא נסגר המקווה, כי זה עניין של פרשנות, ואת אותה פרשנות, שאנחנו חלוקים וחלוקות בה, לגבי ההלכה, אנחנו חלוקות וחלוקים בה לגבי החוק. עכשיו, אני חייבת להגיד לכם, חברי וחברותי, בסוף בסוף יש דבר נורא בסיסי: מדינת ישראל, ייעודה הוא להיות מדינת הלאום, המקלט הבטוח, באמת, גן-עדן לכל היהודיות והיהודים בעולם. איך היא יכולה למלא את הייעוד הזה שלה כשהיא עצמה לא מכירה בחצי מהעם היהודי היום? איך מדינת ישראל יכולה להיות המקום הבטוח לכל העם היהודי, כשלחצי מהעם היהודי אין מקום במדינה הזאת? איך מדינת ישראל יכולה להיות מקום בטוח, כשבאמת היא פוגעת באופן אקטיבי בכל כך הרבה יהודיות ויהודים, שמהר מאוד לא רק לא יוכלו להתחתן כאן, לא רק לא יוכלו להיכנס או לא להיכנס למקווה, לא רק לא יוכלו להתגייר כאן – לא יוכלו לבוא הנה בקצב הזה. זה הדבר הכי גם הזוי, אבל גם דפוק וכואב, שהמדינה היחידה בעולם שלא מכירה בכל סוגי היהודיות והיהודים היא מדינת הלאום של העם היהודי. החוק הזה הוא אחד הביטויים לזה. החוק הזה הוא אחד הדרכים להדיר, לעשות גטאות-גטאות, גדרות-גדרות, להפריד – להפריד ולעשות תוויות: זה כשר, זה לא כשר; זה מקובל, זה לא מקובל; זה נכנס, זה נשאר בחוץ; זאת נכנסת, זאת נשארת בחוץ. תראה, מר גפני, אתה חי במדינת ישראל. בדברים מסוימים אתה חי לפי חוקי ההלכה, אבל בדברים אחרים אתה חי לפי חוקי מדינת ישראל. למשל, דיני ממונות – אתה לא מתנהל לפי הדינים מהגמרא והמשנה וההלכה, אתה מתנהל לפי חוקי מדינת ישראל, לפי כל הרגולציות האלה, כי זה – התאמתם את זה, עשיתם את הפרשנות המתבקשת, שאפשרה לכולנו – – –",10
1497997,2016-11-02,"הצעת חוק החזר הוצאות כספיות בגין עריכת נישואין אזרחיים בחוץ-לארץ למי שאינם רשאים להינשא על-פי הדין הדתי, התשע""ה–2015","תודה רבה לך, גברתי, ותודה רבה לחברתי קסניה סבטלובה, שהציגה בצורה מאוד ברורה את הרציונל של הצעת החוק הזאת. אני אגיד מאוד בקצרה, גברתי: מדינת ישראל מונעת זכות אדם בסיסית, זכות אזרח ואזרחית בסיסית מאוד מכל מי שהיא לא מוכנה לתת לו את תו התקן של: הוא יהודי לפי טעמה, או יהודייה לפי טעמה. אני כבר לא מדברת על דברים יותר ""גרועים"", חס וחלילה בני ובנות אותו מין, חס וחלילה פגומים מבחינה הלכתית – כן יהודים אבל פגומים, נגיד גרושה, נגיד כוהן, חלילה, שהיא מאוהבת בו או הוא מאוהב בה. לא צריך להכריח את האנשים האלה להתחתן בבית-הדין הדתי. אדרבה ואדרבה. אגב, יכול להיות שיש בתי-דין דתיים יהודיים שיסכימו לחתן אותם, נגיד קונסרבטיביים, נגיד רפורמיים, אבל אלה לא מוכרים במדינת ישראל, גברתי היושבת-ראש. מדינתו של העם היהודי, מדינת הלאום של העם היהודי, היא המדינה היחידה בעולם שלא מכירה היום בכל סוגי היהודיות והיהודים. זה המצב האבסורדי ביותר שאפשר להעלות על הדעת. צריך להגיד שרק הבוקר ניסו יהודיות ויהודים מאמינים להתפלל עם ספר תורה בכותל, והותקפו על-ידי יהודים אורתודוקסים בשל אמונתם וניסיונם להתפלל בכותל לפי אמונתם. יהודים תוקפים יהודים אחרים על זה שהם מנסים להתפלל בכותל. אולי כדאי שמישהו יעשה לעצמו קריאת השכמה. מה שאנחנו מציעות בהצעת החוק הזאת זה ממש המינימום; אם המדינה שולחת אנשים להתחתן במקום אחר, המינימום שהיא צריכה לעשות זה לפצות על ההוצאות שזה עולה להם. אני כבר לא מדברת על עוגמת הנפש שנגרמת לאלה שלא יכולות ויכולים לערוך בישראל חתונה כדת וכדין, מה שלא יהיו הדת והדין האלה, עם משפחתם, עם חברותיהם וחבריהם, עם הקרובות והקרובים להם, במדינה שבה הן אזרחיות ואזרחים. תודה רבה.",10
1529163,2017-03-08,הצעת חוק-יסוד: הכנסת (תיקון – ייצוג מינימלי לשני המינים ברשימת מועמדים לכנסת),בשנותיה הראשונות של מדינת ישראל לא הייתה הגבלה על גיל הנישואים.,5
1546875,2017-07-19,"הצעת חוק אימוץ ילדים (תיקון – אימוץ על ידי אזרח ישראלי), התשע""ה–2015: הצעת חוק אימוץ ילדים (תיקון – אימוץ על ידי בני הזוג), התשע""ה–2015","תודה רבה, אדוני. אני שמחה לשמוע שהממשלה שוקלת עוד הפעם את עמדתה. שמענו גם משר הרווחה בעצמו שהוא פנה לבית-המשפט העליון וביקש עוד זמן כדי לשקול מחדש את עמדתו, משום שהאפליה הממש-נוראית הזאת בין בני אדם ועל חשבון טובת ילדות וילדים, באמת לא יכולה להימשך. הצעת החוק שלי מציעה בסך הכול לבחון סוגיית אימוץ לפי טובת הילדה והילד לכל אדם. היא לא מייצרת הבחנה בין קבוצות.",6
1558850,2017-12-05,נאומים בני דקה,"סליחה, אדוני, ממש רק לסיים: תבינו, אני הכי ישראלי שיש. אם לא היו קוראים לי ולד ולא היה לי שיער בלונדיני, הייתם כנראה חושבים שאני מיקס מזרחי. בכל דייט אני מדבר על העניין כאילו הוא מכשול. אמן שמשהו יסתדר בתפיסה שלנו כחברה ותבינו שמה שחשוב באמת זה היחס בין בני הזוג, הערכה, כבוד, אהבה וגם קצת מסורת. אני ישראלי ובאר שבעי גאה שלא מתכנן לעזוב את הארץ לעולם. אני רק מקווה שיימצא פתרון לבעיה הזאת שעומדת לפנינו כחברה, וברמה האישית – שנוגעת לי ולדוברי רוסית אחרים. אנחנו אוהבים את המדינה, רוצים לגדל בה דור המשך, אבל לא שווים בה ולא יכולים להתחתן בה כמו שאר הישראלים. זה לא צודק וזה גם פוגע.",8
1583112,2018-02-20,הצעות לסדר-היום: ציון יום זכויות הקהילה הגאה,"איזה שקט ביום שלישי אחר הצוהריים במליאה. תענוג. תודה, אדוני היושב-ראש, גם אני רוצה להודות לך על דברי הפתיחה שלך, וגם אני רוצה להצטרף לתודות ליועצות וליועצים הפרלמנטריות שלנו, וספציפית במקרה שלי – ליבי צ'יפסר, אורלי לאופולד, ניר רוזן. וגם אני רוצה לחגוג את העובדה שאנחנו היום 30 שנה מאז הביטול של האיסור של משכב זכר, או כמו שקראו לזה, יחסי מין שלא כדרך הטבע. קודם כול, תרשמו לפניכם – גם זה היה במחטף; פשוט לא שמו לב. זאת אומרת, מי שהלכה לחפש בפרוטוקולים של ועדת החוקה לא מצאה את האזכור הזה. זה בא בגרסה ראשונה בלי ביטול הסעיף הזה, ואיכשהו זה הוצבע בשנייה ושלישית עם ביטול הסעיף הזה, בלי שדיברו על זה בקול רם. משום שכשדיברו על זה בקול רם הייתה התנגדות. הייתה התנגדות, וזה בא כמה פעמים עד שזה עבר. זה היה יום היסטורי, היום שבו זה בוטל, אבל כמה עצוב להבין שגם אז זה לא באמת היה בהצהרה בפה מלא של כל חברות וחברי הבית. אבל אני רוצה, ברשותכן וברשותכם, להתעכב על הביטוי הזה, ""כדרך הטבע"". את אמרת, יעל, שזה כדרך הטבע. אני מסכימה איתך. עובדה, זה קיים, זה כדרך הטבע. אבל מה שמטריד אותי, ברשותך היושב-ראש, זה מי קובע או קובעת מה בדרך הטבע? עם כל הכבוד לנו, מתי בפעם האחרונה פגשנו טבע? אולי פה מר ברושי פוגש טבע קצת יותר מאיתנו, אבל גם הוא פוגש טבע, איך להגיד, חרוש, מעובד, מטופל ומתווך לנו. באמת, ציוויליזציות שלמות הטבע מתווך לנו על ידי התרבות. התרבות והדת והחוק מספרים ומודיעים לנו מהו הטבע, ומה כדרך הטבע ומה לא כדרך הטבע. זאת אומרת, אדוני היושב-ראש, החוק מתיימר לקבוע מה כדרך הטבע. זאת אומרת, למשל, לפני 30 שנה, כשביטלו את האיסור על המשכב הזה, שכאילו לא בדרך הטבע, הטרדה מינית עוד בכלל לא הייתה דבר אסור, זאת אומרת היא הייתה לגמרי כדרך הטבע; או לחלופין היום, כאן ועכשיו, זנות עדיין איננה אסורה. זאת אומרת, החוק מכיר בה כדבר שהוא כאילו כדרך הטבע. ועדיין יש גם כאלה שחוזרים ואומרים את המילים המזעזעות האלה: הכי עתיק בעולם, וכל מיני דברים כאלה. זאת אומרת עד היום אנחנו במקום שבו בעלי הכוח – וכשאני אומרת, בהקשר שלנו, ""בעלי הכוח"" אני מדברת על הממשלה הזאת והקואליציה הזאת – מתיימרות ומתיימרים לקבוע מה כדרך הטבע, מה הם מרשים למי לעשות. כי עד היום הממשלה הזאת והקואליציה הזאת מסרבות בעקביות, באופן אקטיבי, באופן אפילו כמעט אלים לפעמים – לאסור, לא רק לא להכיר אלא לאסור על דרך חיים, על רבייה, על אהבה, על קשרים שמתקיימים. ולא זו בלבד שמתקיימים, אלא שמעל 80% מהציבור הישראלית תומכת בהם, מחבקת אותם. הרי בכל משאל על נישואים לבני/בנות אותו מין, הציבור הישראלית, בידיים וברגליים, תומכת בכל הכוח. אבל הממשלה והקואליציה? לא ולא. לא נישואים, לא אימוץ, לא רישום, אפילו, של ילדות וילדים שנולדים לזוגות. כל כך הרבה דברים עדיין אסורים באופן מפורש בחוק לבני/בנות אותו מין, ואם לא אסורים, אז הולכים במין דרכים עקלקלות. ובאמת יש חברות, כמו חברותיי לשדולה, קודם כול מירב בן ארי, אבל גם שרן השכל, שמביאות כספים, מביאות תקציבים, עושות מאמצים, ואנחנו מנסות לפתח נהלים, והכול במין התפתלויות כאלה, מעוותות, בגלל שיש מי שמתעקש שהוא יודע מה דרך הטבע והוא יקבע מה דרך הטבע, והוא לא יאפשר לאחרות ולאחרים לחיות אחרת. אז חבריי וחברותיי חברות וחברי הכנסת, הסיפור הזה של האהבה וההכרה והקבלה של הציבור מצד אחד את הקהילה הגאה, והאי-נכונות העיוורת, האלימה, העוינת של הממשלה והקואליציה הזאת להכיר בחיים האלה, הכל-כך טבעיים, זה עוד פער אחד שמצטרף לפערים רבים שיש בין הממשלה הזאת לבין הציבור שאותו היא אמורה לשרת. וביום הזה אנחנו מקדישות את כל האהבה שלנו ואת כל התמיכה הציבורית ואת כל המחויבות שלנו, כמחוקקות ומחוקקים – כי אם תספור ראשים, יש פה עדיין רוב שמחויב לקהילה הזאת ולשוויון הזכויות שמגיע לה; ולכן, חד-משמעית, לא ננוח עד שלא נוודא שהשוויון הזה נמצא בספר החוקים שלנו. תודה רבה.",10
1585438,2018-03-05,"הצעת חוק שיפוט בתי דין רבניים (נישואין וגירושין) (תיקון – סמכות בין-לאומית בתביעת גירושין של אישה יהודייה), התשע""ה–2015","תודה רבה לאדוני היושב-ראש על שהסכים להחזיר לי את התור שלי. חבריי וחברותיי חברות הכנסת, אני שומעת את סגן השר אלי בן-דהן ואת חברתי שולי מועלם ואת שר הדתות עם הדיבורים על איך נציל את יהודיות ויהודי העולם, ואני אומרת, האם הם מאמינות ומאמינים לעצמם במה שהם אומרים? בואו נדבר על זה רגע ברצינות. מה שיש לנו כאן הוא חוק שנותן עוד סמכויות לבתי הדין הרבניים. גם ככה הקואליציה הזאת מעבירה עכשיו הרחבה של סמכויות בתי הדין הרבניים, שיוכלו לעסוק בעניינים אזרחיים, שלא קשורים בכלל לדיני משפחה אלא בענייני בוררות אזרחיים שונים ומשונים, וגם לא רק על יהודיות ויהודים. אבל עכשיו היא באה להרחיב את סמכויות בתי הדין הרבניים, שימו לב, גם על אנשים שאינם אזרחיות ואזרחי ישראל, זאת אומרת, יהודיות ויהודים שהתחתנו איפשהו בעולם. עכשיו בהצעה הממשלתית, לא סתם התחתנו בדין תורה, התחתנו בנישואים אזרחיים בכלל בווינה, אבל בית הדין בישראל – יש לו סמכות להפעיל עליהם סנקציות בענייני גירושין.",8
1585441,2018-03-05,"הצעת חוק שיפוט בתי דין רבניים (נישואין וגירושין) (תיקון – סמכות בין-לאומית בתביעת גירושין של אישה יהודייה), התשע""ה–2015","אז אתם רוצים עכשיו את היופי הזה להחיל גם על יהודיות ויהודים בחו""ל. בואו נתחיל מעניות עירכם, חמודים. בואו נתחיל מלשחרר מסורבות גט במדינת ישראל. נראה אתכם מצטיינים בזה לפני שאתם מתחילים עם שיגעון גדלות משיחי להחיל את הסמכות הזאת על יהודיות ויהודים במקומות אחרים בעולם. כל הרעיון של הממשלה הזאת והקואליציה הזאת, להרחיב כל הזמן את הסמכויות הדתיות בתחומי החיים של שאר האזרחיות והאזרחים, אם הם רוצים את זה ואם הם לא רוצות ורוצים את זה, עכשיו זה גם מפליג למדינות אחרות מעבר לים. זה דבר שאסור לתת לו יד. תודה.",9
