Id,Date,Topic,Text,Rank
1385524,2014-06-23,"הצעת חוק הרבנות הראשית לישראל (תיקון מס' 7) (רב ראשי אחד לישראל), התשע""ד–2014","אני הייתי תומכת בביטול הרבנות, אבל אני לא תומכת בזה.",3
1390401,2014-07-23,"הצעת חוק להסדר התדיינויות בסכסוכי משפחה (יישוב מוקדם של הסכסוך), התשע""ד–2014","אדוני, תודה רבה, אני מאוד מאוד מאושרת לעמוד כאן היום ולהעביר את הצעת החוק הזאת בקריאה טרומית בהסכמת הממשלה. צריך להגיד שהיא תצטרף לקבוצה של חוקים דומים שהוגשו בעניין זה, ואני מקווה שכשנגיע לוועדה באמת נצליח לייצר ביחד את החוק הטוב ביותר לעניין, ואני מייד אסביר כמובן את העניין. אבל העבודה על החוק הזה הייתה עבודה רבה ביותר, באמת, השקעה עצומה של זמן של חברות ושותפות – ואני אמנה אותן ואודה להן בסוף דברי – וכמובן, חבר הכנסת יריב לוין, שהצטרף, לשמחתי. הרעיון הוא כזה: הרעיון הוא שכל זירת הגירושים במדינת ישראל הפכה בשנים האחרונות, כבר די הרבה שנים – וצריך להגיד: לא רק במדינת ישראל, אלא בכלל בעולם, עם השינויים שעוברים עליו – הפכה להיות סוג של מרחץ דמים. באמת, זירה של התכתשויות איומות ונוראות בין אנשים שפעם כנראה אהבו אחד את השני והחליטו להתחתן ולהקים משפחה, וללדת ולהוליד ילדות וילדים, וחיו ביחד – חלק מהזמן, אני רוצה לקוות, באושר, אם לא בעושר. והם מגיעים לרגע שהם מחליטים לפרק את הבית, וזה הופך להיות מלחמת עולם, פשוט מלחמת עולם איומה ונוראית, שכולם חוטפים; כולם. הילדות והילדים בראש ובראשונה, כמובן, כי זה לא בידיים שלהם והם האובייקטים, הם הופכים להיות ממש האובייקטים של המלחמה הזאת. לפעמים הם הופכים להיות כלי נשק במלחמה הזאת. הם מנוצלים לפעמים בידי אחד ההורים, בידי שני ההורים, זה נגד זה. כמובן, ההורים עצמם נפגעים, כל אחד ואחד מהם, לא משנה, גם מי שיותר אלים ואגרסיבי וגם מי שפחות אלים ואגרסיבי; וכמובן, הבית כבית, ואפילו מבחינה כלכלית המשפחה נפגעת פגיעה אנושה, משום שבדרך כלל התהליך הזה עולה המון כסף, לוקח המון זמן שבו המשפחה מוציאה עוד כסף נלווה על עוד בתים, על עוד הסדרים. ומעבר לזה שזה מכוער, זה באמת פוגע בכל אחת ואחד באופן עמוק ואנוש. ילדות וילדים שעוברים את התהליכים האלה, לוקח שנים רבות ביותר לשקם אותם, ופעמים רבות הצלקות האלה ניכרות עליהם עוד הרבה מאוד מאוד מאוד שנים אחרי. כל זה קורה משתי סיבות מרכזיות, לדעתי, וצריך להכיר בזה: אחת היא המהפכה הפמיניסטית. פעם נשים התחתנו עם גברים פשוט משום שלא הייתה להן אלטרנטיבה בשביל להתפרנס ולהתקיים. הן עברו מחסות האב לחסות הבעל, וזאת הייתה הדרך היחידה שלהן לקבל בית, הגנה וקיום בסיסי. תמורת זה הן סיפקו שירותי הולדה, שירותי מין, תחזוקת הבית וכו' וכו'. זאת הייתה היחידה: הבעל סיפק את החלק הכלכלי המוכר, זה שסופרים אותו בכסף, והאישה סיפקה את החלק הכלכלי הלא-מוכר של עבודות הבית וגידול הילדות והילדים. גירושין בסיטואציה כזאת היו מאוד קשים לעשייה. א. בואו נזכור שעד לפני 100 שנה לנשים לא היה בכלל מעמד עצמאי בפני החוק, וודאי לכן היה קושי בכלל לטעון טענות בפני בית-משפט או כל ערכאה שעסקה בגירושין. וגם מבחינה כלכלית נשים היו במקום אחר, כי לנשים לא היו נכסים משל עצמן. ב-100 השנה האחרונות, בגדול, אפשר להגיד, נשים קיבלו זכות בחירה ולאט-לאט יצאו לעולם העבודה והשתלבו בעולם העבודה באופן דרמטי, והיום הן גם יכולות, גם רוצות, וגם צריך להגיד צריכות לצאת לעבוד, משום שאין היום במציאות הכלכלית שלנו אפשרות להתפרנס באמת ממשכורת אחת; היא צריכה להיות משכורת מאוד נדירה במקומותינו. עכשיו, יוצא שבינתיים גם קרו עוד כמה שינויים בעולם, במיוחד בישראל, אגב. צריך להגיד שהמשפטיזציה, כמו שאנחנו מכנות ומכנים אותה, השתלטה על חיינו במידה רבה מאוד, ויש רבות ורבים שיכולים להתפרנס מהתהליכים האלה של הגירושין. בקיצור, צריך להגיד שהמצב לא טוב, והצעת החוק שלנו באה לנסות ולשפר אותו באופן ניכר, לא באחוזים קטנים. אני אעשה כוכבית ואגיד מראש שהצעת החוק שלנו, של יריב לוין ושלי, איננה עוסקת במירוץ הסמכויות. אנחנו לא נכנסות ולא נכנסים כרגע להפרדה או לבעיה, שהיא קיימת. העובדה שיש בישראל רק גירושין דתיים והגט עצמו עדיין תלוי ברצונו הטוב של בית-הדין היא בעיה. אנחנו לא נכנסות אליה בהצעת החוק הזאת, משום שכל הרעיון של הצעת החוק הזאת הוא להוריד את האש, להוריד את רמת הסכסוך ולא להגביר אותו ולהגדיל גם את הסכסוך של לאיזו ערכאה ילך הזוג להסתכסך. לכן, הדבר הראשון שקורה בחוק שלנו הוא שכשזוג מחליט – זוג או אחד מבני-הזוג, אחת מבני-הזוג – להגיש בקשה לגירושין, תפיסת הסמכות, מה שנקרא בישראל, תיעשה באותו אופן. כלומר, איפה שתפתחי תיק שם יתנהל התיק. אבל זה ייפתח בהליך מקדמי, ההליך המקדמי הזה מתקיים על-ידי שתיים עד ארבע פגישות במה שנקרא יחידות הסיוע, שהיום קיימות גם ליד בית-הדין הרבני. אגב, אני אפתח סוגריים ואגיד שהצעת החוק שלנו היא פיתוח של תזכיר הצעת החוק הממשלתית, שעברה גם היא כבר בקריאה ראשונה, והיא תוצאה של עבודה של ועדה שנקראת ועדת שנהב, שישבה על המדוכה זמן רב מאוד, אבל כשהיא עשתה את העבודה עדיין לא היו קיימות יחידות הסיוע שליד בית-הדין הרבני; היו קיימות רק יחידות הסיוע שליד בתי-המשפט לענייני משפחה. עכשיו, לשמחתנו, כבר קיימות יחידות סיוע גם ליד בתי-הדין, ולכן אפשר לעשות את ההליך הזה בלי להיכנס לסוגיית מירוץ הסמכויות. אני אגיד בתחילת הדברים נתון שבאמת מאוד חשוב לדעת. יש כבר מחקר אקדמי לגבי יחידות הסיוע האלה שנמצאות ליד בתי-המשפט לענייני משפחה, והמסקנות מהמחקרים האלה מראות בצורה חד-משמעית ומובהקת שבכל מקרה שהועבר לטיפולן של יחידות הסיוע, מתבצע שם תהליך שהוא התהליך שאנחנו מציעות בהצעת החוק, כלומר תהליך שמאפשר לצדדים לבחור בדרך אחרת שאיננה דרך של התכתשות משפטית או של מאבק משפטי, אלא דרך של גישור או גירושין בשיתוף פעולה או טיפול משפחתי או כל אחד מהדברים האלה או אולי שילובים שונים שלהם; שכל המקרים שהגיעו לטיפולן של יחידות הסיוע נגמרו בתוצאות טובות בהרבה ממה שאפשר היה לצפות. יצוין שחלק ניכר מהמקרים שמגיעים לטיפולן של יחידות הסיוע הם מלכתחילה מקרים קשים, בעייתיים ואלימים יותר מהממוצע, ולמרות זאת תוצאות הטיפול בהם כל כך טובות. לכן, מה שאנחנו מציעות הוא הדבר הבא: ייפתח תיק, או בבית-הדין הרבני או בבית-המשפט לענייני משפחה, בהליך מקדמי שבו יוזמנו בני-הזוג ללא מייצגים, ללא מי מטעמם; הם יצטרכו לבוא בעצמם, וזה כמו זימון לבית-משפט. הם יצטרכו לבוא בעצמם לשתיים עד ארבע פגישות שנקראות פגישות מהו""ת, ובהן יינתנו להם כל האפשרויות שעומדות לפניהם חוץ מאשר מאבק משפטי, והתוצאות שיכולות להיות שם, או יותר נכון גם המצב החוקי של מה פועל לרעתו ומה פועל לטובתו של כל אחד מהצדדים. זה ייעשה על-ידי אנשי טיפול, אנשי ייעוץ משפטי, ובמקביל ייעשה בעצם מעין אבחון, כך שאנשי המקצוע ונשות המקצוע של יחידת הסיוע יוכלו להציע לזוג מה הדרך הטובה ביותר, לפי מה שמתרשמים ומתרשמות מהם ומהרצונות שלהם. צריך להגיד – שוב, אני עושה כוכבית – שבמקרה שביחידת הסיוע מתרשמות שיש מקרה של אלימות קשה, במקרה שהן מתרשמות שיש מצב של באמת כאסח שאין מה לעשות ואי-אפשר לגשר עליו, ליחידת הסיוע יש סמכות להפנות את המקרה ישר לבית-המשפט בלי לעבור את התהליך הזה. אחרי הפגישות ביחידת הסיוע הזוג ילך לחשוב כמה שיחשוב, והכול פה תחום בזמנים, והזוג צריך להסכים לתהליך יישוב הסכסוכים. חשוב לי להדגיש כאן, לכל אלה שחוששים מזה שיכריחו אותם, יכפו עליהם לעבור איזה תהליך גישור או איזה תהליך טיפול: אין חיה כזאת. אי-אפשר לכפות על אף אחד ואף אחת תהליך גישורי, תהליך שדורש שיתוף פעולה במהותו. לכן זה תלוי-הסכמה בהכרח. מניסיוננו ומהבנתנו, הסיכוי שתהיה הסכמה כזאת הוא סיכוי גבוה – מה שעשוי באמת להביא לתהליך קצר יותר, וכאן אני שמה באמת קו עבה מתחת למילים ""קצר יותר"". הרבה גברים, בעיקר, אני חייבת להגיד, ששמעו על הצעת החוק שלי, נבהלו ואמרו לי: אני רוצה להתגרש; אז מה, עכשיו את מכריחה אותי לבזבז זמן על תהליכים מיותרים? ובכן, לא. אתה רוצה להתגרש, ואני אומרת לך: זו הדרך הקצרה והיעילה יותר והבריאה יותר וממנה יצאו כולם וכולן במצב טוב יותר ואולי אף בריא יותר מזה שנכנסתם אליו, או ודאי טוב יותר מזה שהייתן מגיעות אליו אילו הייתן מתכתשות בבית-המשפט. זאת בתמצית הצעת החוק והרציונל שעומד מאחוריה. רק להגיד, בבקשה, תודות. קודם כול, חברים וחברות יקרים, פרופסורים ופרופסוריות ועורכות-דין רבות שייעצו לנו בעניין זה, אבל בעיקר ומעל לכול עורכת-הדין מיכל פיין מעמותת ""להתגרש בשלום"", שבאמת עשתה ימים ולילות על ההצעה המאוד-מורכבת והמאוד מאוד טובה הזאת. תודה על תמיכתכם.",6
1391179,2014-07-28,"הצעת חוק להסדר התדיינויות בסכסוכי משפחה, התשע""ד–2014","תודה, אדוני. אני רוצה לברך על הצעת החוק הממשלתית הזאת, שנכתבה בעקבות דוח של ועדה, שנקראת ועדת שנהב. העיקרון שלה הוא עיקרון מאוד מאוד מצוין, כמו שהסביר פה השר עוזי לנדאו באריכות. הרעיון הוא – מה שלא נכלל, ולא יעבור בגלל ההצעה הזאת: זה לא מבטל את מירוץ הסמכויות, מה שנקרא היום במקומותינו ""מירוץ הסמכויות"", אבל בא לסייע לבני-זוג שרוצות, רוצים, להתגרש, לעשות את זה, או לפחות לתת את התנאים המקסימליים בשביל לעשות את זה בדרכי שלום ולא במלחמת עולם ובמרחץ דמים כמו שקורה היום יותר ויותר, בצורה שפוגעת גם בבני-הזוג, גם בילדות ובילדים, וצריך להגיד – גם בכלכלה של המשפחה, בצורה קשה מאוד ולאורך שנים רבות. הצעת החוק הזאת נותנת את המסגרת לעשות את זה. כאמור, היא נותנת את העיקרון, והיא נותנת קווים כלליים שבהם אפשר וצריך לעשות את זה. לשמחתי, העברנו כאן ביום רביעי את הצעת החוק של חבר הכנסת יריב לוין ושלי, שיורדת באמת לתוך-תוכי התהליך וקובעת את הנהלים הפרטיקולריים שדרכם אנחנו נעשה את זה, וגם מתעכבת על כל הקשיים – ויש קשיים שעולים כאן, כל מיני חששות שעולים: האם זה יעכב את ההליך? האם זה יעלה יותר כסף? מה יקרה בינתיים לזכויות שלי? מה יקרה כשצריך להגן על מי שזקוקה אולי להגנה? מה יקרה במקרים של אלימות? יש הרבה מאוד דברים שצריך באמת לתת עליהם את הדעת ולהתייחס אליהם, והצעת החוק שלנו עושה את זה באמת עד התו והתג האחרון. לשמחתי, היא תוצמד להצעה זאת, יחד עם הצעות של חברת הכנסת שולי מועלם וחברת הכנסת עליזה לביא, שהוגשו בעניין הזה, ובלי שום ספק, בעבודה המשותפת בוועדה הן תשפרנה בצורה דרמטית את האופן שבו גירושין מתנהלים היום במדינת ישראל. שוב אני אומרת, אנחנו לא נכנסות למירוץ הסמכויות, לא כי אני מקבלת שיש היגיון באופן שבו נישואין וגירושין מתנהלים מהבחינה הזאת היום במדינת ישראל, אלא משום שבבואנו לרצות באמת להפחית את המריבות, להפחית את הלחץ, להפחית את הנושאים שעליהם יש סיבה להתנגש, לריב ולהקיז דם, האחד נגד השני, האחת נגד השנייה, האחת נגד השני, אסור להיכנס למקום הזה. אין בכך כדי להגיד שאנחנו מקבלות את ההיגיון שבישראל יש אך ורק נישואין דתיים אפשריים, ולא כמו שצריך להיות במדינה מערבית מתוקנת ודמוקרטית – נישואין אזרחיים. בקיצור, לסיכום, אדוני, אני מברכת על ההצעה, אני קוראת לחברותי ולחברי כמובן להצביע בעדה, ואני בטוחה שכשבמושב הבא נביא את ההצעה אחרי שעבדנו עליה בוועדה, היא תהיה טובה עוד יותר, ותביא עתיד טוב יותר להרבה מאוד נשים, גברים, ילדות וילדים במדינת ישראל. תודה רבה.",8
1448332,2015-12-21,"הצעת חוק לתיקון פקודת הראיות (מס' 16), התשע""ו–2015","תודה רבה, אדוני היושב-ראש, אני רוצה לברך מאוד על התיקון החשוב, המצוין והטוב-מאוד הזה, ואני רוצה להודות לחברי חבר הכנסת בני בגין, שניהל את ההכנה לדיון הזה, החליף את יושב-ראש ועדת החוקה ניסן סלומינסקי וניהל ביד רמה דיון של ארבע שעות בוועדת החוקה. זה תיקון חשוב ועקרוני, ואני רוצה לדבר על חלק קטן ממנו, שעשוי להיראות שולי אבל הוא מאוד מאוד דרמטי. הפרק על מי כשר להעיד הוא חלק מהחומר למבחן ההסמכה של לשכת עורכות ועורכי-הדין. עד עכשיו מי שנמצא ממש בפתח המקצוע, במשוכה האחרונה, ודאי למדה או למד, אם זה לא התגלה להם קודם בחיים, שבני-זוג ובנות-זוג מאותו המין לא זכאים לאותן הגנות כמו בני-זוג סטרייטים; הם פשוט לא שוות ושווים. כשבני-זוג לא כשרים להעיד זה נגד זה, הם רק בני-זוג ובנות-זוג סטרייטים ובמקרה הזה הייתה גם דרישה לנשואות ונשואים. התיקון הזה משנה את המצב, מפרק עוד לבנה מהחומה של חוסר השוויון, מפרק עוד לבנה מההתייחסות לנישואין כדת משה וישראל כאל האלטרנטיבה היחידה לקיום משפחתי ולקיום זוגי במדינת ישראל. החוק הישראלי צריך לתת זכויות שוות לכל בני-הזוג ובנות-הזוג – מאותו המין, שלא מאותו המין, נשואות ככה, נשואים אחרת – והתיקון הזה היום עושה צעד חשוב בכיוון הנכון. תודה רבה.",10
1464961,2016-02-23,הצעות לסדר-היום: ציון יום הזכויות לקהילה הגאה בכנסת,"גברתי היושבת-ראש, תודה, ושלום, חברות וחברים. תענוג, תענוג, תענוג שהייתם אתנו כל היום המדהים הזה, ותודה ליושב-ראש הכנסת, שבאמת אישר אותו בכזאת מהירות ובכזה חפץ לב, בכזה רוחב לב, צריך להגיד. פעם ראשונה שבכנסת ישראל מצוין היום לזכויות הקהילה הגאה – אכן יום חגיגי ויום מרגש, והיו בו דיונים חשובים להפליא, ואורחות ואורחים נפלאים. אבל הוא היה רק חגיגי. אני קיוויתי, באמת קיוויתי, אני אומרת בכנות, קיוויתי שאני אוכל לעמוד כאן היום, יום שלישי של הכנסת, ולהגיש הצעת חוק שתעבור מה שנקרא בהסכמה, שגם הקואליציה תצביע בעדה וגם האופוזיציה תצביע בעדה, והיא תעבור בקריאה טרומית. הצעת החוק שלי מדברת על שינוי החוק בנושא האימוץ. היום החוק אומר: אין אימוץ אלא על-ידי איש ואשתו, נשואים כמו שמדינת ישראל מכירה בנישואים, וכזכור, במדינת ישראל עדיין אין נישואים אזרחיים. אז נכון, חברי חבר הכנסת הרצוג, יושב-ראש האופוזיציה, יושב-ראש המפלגה שלי, בשבתו כשר רווחה עשה שינויים שונים בתקנות, ויש יותר אנשות ואנשים שיכולות היום לאמץ ילדות וילדים בישראל, אבל החוק – החוק עדיין מפלה, החוק עדיין מדיר. החוק עדיין לא מכיר בקיומם של נשים וגברים שההעדפות שלהן אחרות. החוק עדיין לא מוכן לקבל את הקיום הקווירי, את הקיום הלהטב""קי. המשמעות של זה היא לא רק בתחום האימוץ, אלא בהרבה מאוד תחומים אחרים, ויעידו על כך לפחות שבע הצעות החוק שעלו שלשום לוועדת השרים ונדחו על-ידי הממשלה הזאת באופן מוחלט. החוק בישראל עדיין פשוט מדיר ומתעלם, ולא מקבל ולא נותן את הזכויות לקהילה הגאה. עכשיו הרחיבה פה חברתי – ומרחיב ראש הממשלה, כמו שאמרה חברתי מיכל רוזין, בכל הזדמנות, בזכויות הרבות שיש לקהילה בישראל. בפועל, במידה מאוד רבה זה נכון, אבל כל הזכויות האלה הושגו במאבקים קשים ומרים של חברות וחברי קהילה אמיצים, של שותפות ושותפים למאבקים האלה, חלקם כאן בכנסת, חלקם מחוץ לכנסת, במשך שנים ארוכות, וכולם הסתיימו בהכרעות של בתי-המשפט. אבל הבית הזה, הכנסת, הגוף המחוקק, הרשות המחוקקת של מדינת ישראל – שקובעת את הנורמות של החיים שלנו, קובעת מי אנחנו, מה אנחנו, מה מותר, מה אסור, למי מותר ולמי אסור, לפי מה רושמות ורושמים, את מי רושמות ורושמים ובאיזה תעודה – הבית הזה עדיין מתעקש לסובב את הראש, לסובב את הגב, אם תרצו, לקהילה הגאה. אני אגיד יותר גרוע מזה, ברשותכן וברשותכם: הממשלה הזאת, הקואליציה הזאת, מקבלת כאיזה מין גזירת גורל את העובדה שחלקים מסוימים ממנה לא מסוגלים לבלוע את הקיום הקווירי, הלסבי, ההומואי, הטרנסי, הבי; מקבלת כמו גזירת גורל את זה שהחלקים האלה עדיין ממש מוקיעים את הקהילה הזאת. אפילו לא נאבקים על זה, אפילו לא מנסים לאתגר את החלקים ולראות האם בשל כך באמת יפרקו את הממשלה, האם בשביל זה באמת יזרקו לפח את כל ההישגים הפוליטיים, הכלכליים, הכספיים האחרים שלהם, אלא באמת מין השלמה שכזאת. יש פה ציבור – ואגב, לא בהכרח הציבור, אלא המנהיגים המסוימים שלו שיושבים כאן – שאיזה קוד פוליטי עלום, שמרני וחשוך שלהם מחייב אותם להמשיך ולהתכחש לקהילה הגאה, וכל הקואליציה רוקדת לפי החליל שלהם. אז כן, יום הזכויות לקהילה הגאה בכנסת הוא יום שמח, גדול, היסטורי – צריך גם להגיד את זה, גם זה ציון דרך היסטורי. אבל ההיסטוריה שלנו, באותה מידה ובאותה נשימה, ביום הזה תקועה – תקועה עמוק באי-שוויון, באפליה, באי-הכרה של החוק במדינת ישראל בקהילה הגאה ובשוויון האנושי שמגיע לכל אחת ולכל אחד בה, פשוט כי כולנו בנות ובני אדם. הלוואי, אמן, שלא ייקח יותר מדי זמן, ונעמוד כאן ונצביע מחר על החוקים האלה שלנו. אנחנו נצביע בעדם. אני יכולה רק לאחל – גם לקואליציה הזאת, אבל גם לכל אחת ואחד מאתנו – שבאמת מאוד מהר נצביע כולנו בעד החוקים האלה, שיביאו לשוויון בפני החוק, שוויון אמיתי של כל האזרחיות והאזרחים במדינת ישראל, בלי הבדל דת, גזע, מין, לאום, נטייה פוליטית, נטייה מינית וכל נטייה אחרת. תודה רבה.",8
